{"$schema":"https://json-schema.org/draft/2020-12/schema","$id":"https://schemas.oteryn.local/game-catalog/v1.1/game-catalog-snapshot.schema.json","title":"Oteryn Game Catalog Snapshot v1.1","type":"object","additionalProperties":false,"required":["contract","schema_version","snapshot","releases","entities","relations"],"properties":{"contract":{"const":"oteryn.game-catalog"},"schema_version":{"const":"1.1.0"},"snapshot":{"$ref":"#/$defs/snapshot"},"releases":{"type":"array","minItems":1,"maxItems":512,"items":{"$ref":"#/$defs/release"}},"entities":{"type":"array","maxItems":200000,"items":{"oneOf":[{"$ref":"#/$defs/item"},{"$ref":"#/$defs/creature"}]}},"relations":{"type":"array","maxItems":1000000,"items":{"$ref":"#/$defs/loot"}}},"$defs":{"sha256":{"type":"string","pattern":"^[0-9a-f]{64}$"},"gitSha":{"type":"string","pattern":"^[0-9a-f]{40,64}$"},"releaseKey":{"type":"string","minLength":1,"maxLength":32,"pattern":"^[0-9]+(?:\\.[0-9]+){1,3}(?:[-+][A-Za-z0-9.-]+)?$"},"nullableRelease":{"oneOf":[{"$ref":"#/$defs/releaseKey"},{"type":"null"}]},"canonicalKey":{"type":"string","minLength":3,"maxLength":180,"pattern":"^[a-z][a-z0-9_-]*:[a-z0-9][a-z0-9._-]*$"},"completeness":{"enum":["complete","partial","unverified","disabled","missing_dependencies"]},"sourcePath":{"type":["string","null"],"maxLength":512,"pattern":"^(?!/)(?!.*(?:^|/)\\.\\.(?:/|$)).*$"},"identifier":{"type":"object","additionalProperties":false,"required":["namespace","value"],"properties":{"namespace":{"type":"string","minLength":1,"maxLength":80,"pattern":"^[a-z][a-z0-9._-]*$"},"value":{"type":"string","minLength":1,"maxLength":160}}},"snapshot":{"type":"object","additionalProperties":false,"required":["generated_at","canary_commit_sha","protocol_profile","runtime_release","content_target_release","verified_content_through_release","appearances_sha256","entity_count","relation_count"],"properties":{"generated_at":{"type":"string","format":"date-time"},"canary_commit_sha":{"$ref":"#/$defs/gitSha"},"datapack_commit_sha":{"oneOf":[{"$ref":"#/$defs/gitSha"},{"type":"null"}]},"protocol_profile":{"type":"string","minLength":1,"maxLength":80},"runtime_release":{"$ref":"#/$defs/releaseKey"},"content_target_release":{"$ref":"#/$defs/releaseKey"},"verified_content_through_release":{"$ref":"#/$defs/nullableRelease"},"contains_content_through_release":{"$ref":"#/$defs/nullableRelease"},"appearances_sha256":{"$ref":"#/$defs/sha256"},"map_sha256":{"oneOf":[{"$ref":"#/$defs/sha256"},{"type":"null"}]},"producer_build_id":{"type":["string","null"],"maxLength":160},"entity_count":{"type":"integer","minimum":0,"maximum":200000},"relation_count":{"type":"integer","minimum":0,"maximum":1000000}}},"release":{"type":"object","additionalProperties":false,"required":["key","display_label","major","minor","patch","build","release_order","protocol_family","released_at"],"properties":{"key":{"$ref":"#/$defs/releaseKey"},"display_label":{"type":"string","minLength":1,"maxLength":48},"major":{"type":"integer","minimum":0,"maximum":999},"minor":{"type":"integer","minimum":0,"maximum":999},"patch":{"type":"integer","minimum":0,"maximum":999},"build":{"type":["integer","null"],"minimum":0,"maximum":2147483647},"release_order":{"type":"integer","minimum":0,"maximum":9223372036854775807},"protocol_family":{"type":["string","null"],"maxLength":80},"released_at":{"type":["string","null"],"format":"date-time"}}},"entityCommon":{"type":"object","required":["type","canonical_key","introduced_in","removed_in","completeness","availability","runtime_present","enabled","identifiers","source_path","data"],"properties":{"canonical_key":{"$ref":"#/$defs/canonicalKey"},"introduced_in":{"$ref":"#/$defs/nullableRelease"},"removed_in":{"$ref":"#/$defs/nullableRelease"},"completeness":{"$ref":"#/$defs/completeness"},"runtime_present":{"type":"boolean"},"enabled":{"type":"boolean"},"identifiers":{"type":"array","maxItems":32,"items":{"$ref":"#/$defs/identifier"}},"source_path":{"$ref":"#/$defs/sourcePath"}}},"item":{"allOf":[{"$ref":"#/$defs/entityCommon"},{"type":"object","additionalProperties":false,"properties":{"type":{"const":"item"},"canonical_key":{"$ref":"#/$defs/canonicalKey"},"introduced_in":{"$ref":"#/$defs/nullableRelease"},"removed_in":{"$ref":"#/$defs/nullableRelease"},"completeness":{"$ref":"#/$defs/completeness"},"availability":{"enum":["obtainable","quest_only","boss_only","event_only","npc_only","starter","registered_only","admin_only","unreachable","unknown"]},"runtime_present":{"type":"boolean"},"enabled":{"type":"boolean"},"identifiers":{"type":"array","maxItems":32,"items":{"$ref":"#/$defs/identifier"}},"source_path":{"$ref":"#/$defs/sourcePath"},"data":{"$ref":"#/$defs/itemData"}}}]},"creature":{"allOf":[{"$ref":"#/$defs/entityCommon"},{"type":"object","additionalProperties":false,"properties":{"type":{"const":"creature"},"canonical_key":{"$ref":"#/$defs/canonicalKey"},"introduced_in":{"$ref":"#/$defs/nullableRelease"},"removed_in":{"$ref":"#/$defs/nullableRelease"},"completeness":{"$ref":"#/$defs/completeness"},"availability":{"enum":["encounterable","boss_only","event_only","quest_only","registered_only","admin_only","unreachable","unknown"]},"runtime_present":{"type":"boolean"},"enabled":{"type":"boolean"},"identifiers":{"type":"array","maxItems":32,"items":{"$ref":"#/$defs/identifier"}},"source_path":{"$ref":"#/$defs/sourcePath"},"data":{"$ref":"#/$defs/creatureData"}}}]},"itemData":{"type":"object","additionalProperties":false,"required":["server_id","name","category","stackable","pickupable","attributes"],"properties":{"server_id":{"type":"integer","minimum":0,"maximum":65535},"client_id":{"type":["integer","null"],"minimum":0,"maximum":4294967295},"ware_id":{"type":["integer","null"],"minimum":0,"maximum":65535},"name":{"type":"string","minLength":1,"maxLength":200},"description":{"type":["string","null"],"maxLength":2000},"category":{"type":"string","minLength":1,"maxLength":80},"weapon_type":{"type":["string","null"],"maxLength":40},"attack":{"type":["integer","null"],"minimum":-32768,"maximum":32767},"defense":{"type":["integer","null"],"minimum":-32768,"maximum":32767},"extra_defense":{"type":["integer","null"],"minimum":-32768,"maximum":32767},"armor":{"type":["integer","null"],"minimum":-32768,"maximum":32767},"range":{"type":["integer","null"],"minimum":0,"maximum":255},"weight":{"type":["integer","null"],"minimum":0,"maximum":2147483647},"minimum_level":{"type":["integer","null"],"minimum":0,"maximum":65535},"vocations":{"type":["array","null"],"maxItems":64,"items":{"type":"string","maxLength":80}},"slot_position":{"type":["integer","null"],"minimum":0,"maximum":4294967295},"imbuement_slots":{"type":["integer","null"],"minimum":0,"maximum":255},"upgrade_classification":{"type":["integer","null"],"minimum":0,"maximum":255},"element_type":{"type":["string","null"],"maxLength":40},"element_value":{"type":["integer","null"],"minimum":-32768,"maximum":32767},"stackable":{"type":"boolean"},"pickupable":{"type":"boolean"},"image_key":{"type":["string","null"],"maxLength":160},"attributes":{"type":"object","maxProperties":128}}},"creatureData":{"type":"object","additionalProperties":false,"required":["name","health","max_health","experience","speed","armor","defense","is_boss","is_reward_boss","elements","immunities","attacks","defenses","attributes"],"properties":{"name":{"type":"string","minLength":1,"maxLength":200},"description":{"type":["string","null"],"maxLength":2000},"race_id":{"type":["integer","null"],"minimum":0,"maximum":65535},"look_type":{"type":["integer","null"],"minimum":0,"maximum":65535},"health":{"type":"integer","minimum":0,"maximum":2147483647},"max_health":{"type":"integer","minimum":0,"maximum":2147483647},"experience":{"type":"integer","minimum":0,"maximum":9223372036854775807},"speed":{"type":"integer","minimum":0,"maximum":65535},"armor":{"type":"integer","minimum":-32768,"maximum":32767},"defense":{"type":"integer","minimum":-32768,"maximum":32767},"mitigation":{"type":["number","null"],"minimum":-1000,"maximum":1000},"is_boss":{"type":"boolean"},"is_reward_boss":{"type":"boolean"},"bestiary_class":{"type":["string","null"],"maxLength":120},"bestiary_race":{"type":["string","null"],"maxLength":120},"bestiary_occurrence":{"type":["integer","null"],"minimum":0,"maximum":255},"bestiary_to_kill":{"type":["integer","null"],"minimum":0,"maximum":65535},"charm_points":{"type":["integer","null"],"minimum":0,"maximum":65535},"elements":{"type":"array","maxItems":64},"immunities":{"type":"array","maxItems":128},"attacks":{"type":"array","maxItems":256},"defenses":{"type":"array","maxItems":256},"attributes":{"type":"object","maxProperties":128}}},"loot":{"type":"object","additionalProperties":false,"required":["type","canonical_key","source","target","introduced_in","removed_in","completeness","enabled","source_path","data"],"properties":{"type":{"const":"creature_loot"},"canonical_key":{"type":"string","minLength":3,"maxLength":240,"pattern":"^loot:[a-z0-9][a-z0-9._-]*:[a-z0-9][a-z0-9._-]*(?::[0-9]+)?$"},"source":{"$ref":"#/$defs/canonicalKey"},"target":{"$ref":"#/$defs/canonicalKey"},"introduced_in":{"$ref":"#/$defs/nullableRelease"},"removed_in":{"$ref":"#/$defs/nullableRelease"},"completeness":{"$ref":"#/$defs/completeness"},"enabled":{"type":"boolean"},"source_path":{"$ref":"#/$defs/sourcePath"},"data":{"type":"object","additionalProperties":false,"required":["chance_numerator","chance_denominator","minimum_count","maximum_count","container_path","condition_data"],"properties":{"chance_numerator":{"type":"integer","minimum":0,"maximum":4294967295},"chance_denominator":{"type":"integer","minimum":1,"maximum":4294967295},"minimum_count":{"type":"integer","minimum":0,"maximum":65535},"maximum_count":{"type":"integer","minimum":0,"maximum":65535},"container_path":{"type":["string","null"],"maxLength":512},"condition_data":{"type":["object","null"],"maxProperties":64}}}}}}}
