{"contract":"oteryn.game-catalog","schema_version":"1.1.0","snapshot":{"generated_at":"2026-07-28T00:00:00Z","canary_commit_sha":"4afd98e5b3d9cf0ce50aca73c697bedcd9ecbc9e","datapack_commit_sha":null,"protocol_profile":"oteryn-current","runtime_release":"15.20","content_target_release":"15.20","verified_content_through_release":null,"contains_content_through_release":"15.30","appearances_sha256":"0000000000000000000000000000000000000000000000000000000000000000","map_sha256":null,"producer_build_id":"shared-fixture-v1","entity_count":4,"relation_count":2},"releases":[{"key":"15.20","display_label":"15.20","major":15,"minor":20,"patch":0,"build":null,"release_order":152000,"protocol_family":"oteryn-current","released_at":null},{"key":"15.30","display_label":"15.30","major":15,"minor":30,"patch":0,"build":null,"release_order":153000,"protocol_family":"oteryn-current","released_at":null}],"entities":[{"type":"creature","canonical_key":"creature:dragon","introduced_in":"15.20","removed_in":null,"completeness":"complete","availability":"encounterable","runtime_present":true,"enabled":true,"identifiers":[{"namespace":"canary.monster_name","value":"Dragon"}],"source_path":"monster/dragons/dragon.lua","data":{"name":"Dragon","description":null,"race_id":34,"look_type":34,"health":1000,"max_health":1000,"experience":700,"speed":180,"armor":25,"defense":30,"mitigation":null,"is_boss":false,"is_reward_boss":false,"bestiary_class":"Dragon","bestiary_race":"Dragon","bestiary_occurrence":1,"bestiary_to_kill":1000,"charm_points":25,"elements":[],"immunities":[],"attacks":[],"defenses":[],"attributes":{}}},{"type":"creature","canonical_key":"creature:unfinished-beast","introduced_in":"15.20","removed_in":null,"completeness":"partial","availability":"registered_only","runtime_present":true,"enabled":true,"identifiers":[{"namespace":"canary.monster_name","value":"Unfinished Beast"}],"source_path":"monster/experimental/unfinished_beast.lua","data":{"name":"Unfinished Beast","description":null,"race_id":null,"look_type":null,"health":500,"max_health":500,"experience":0,"speed":160,"armor":10,"defense":10,"mitigation":null,"is_boss":false,"is_reward_boss":false,"bestiary_class":null,"bestiary_race":null,"bestiary_occurrence":null,"bestiary_to_kill":null,"charm_points":null,"elements":[],"immunities":[],"attacks":[],"defenses":[],"attributes":{}}},{"type":"item","canonical_key":"item:dragon-shield","introduced_in":"15.20","removed_in":null,"completeness":"complete","availability":"obtainable","runtime_present":true,"enabled":true,"identifiers":[{"namespace":"canary.server_item_id","value":"2516"}],"source_path":"items/items.xml","data":{"server_id":2516,"client_id":3416,"ware_id":null,"name":"Dragon Shield","description":null,"category":"shield","weapon_type":"shield","attack":null,"defense":31,"extra_defense":null,"armor":null,"range":null,"weight":6000,"minimum_level":null,"vocations":null,"slot_position":32,"imbuement_slots":1,"upgrade_classification":1,"element_type":null,"element_value":null,"stackable":false,"pickupable":true,"image_key":null,"attributes":{}}},{"type":"item","canonical_key":"item:future-blade","introduced_in":"15.30","removed_in":null,"completeness":"complete","availability":"obtainable","runtime_present":true,"enabled":true,"identifiers":[{"namespace":"canary.server_item_id","value":"65000"}],"source_path":"items/items.xml","data":{"server_id":65000,"client_id":null,"ware_id":null,"name":"Future Blade","description":null,"category":"sword","weapon_type":"sword","attack":50,"defense":30,"extra_defense":2,"armor":null,"range":1,"weight":4200,"minimum_level":100,"vocations":["knight"],"slot_position":48,"imbuement_slots":2,"upgrade_classification":3,"element_type":null,"element_value":null,"stackable":false,"pickupable":true,"image_key":null,"attributes":{"hands":1}}}],"relations":[{"type":"creature_loot","canonical_key":"loot:dragon:dragon-shield","source":"creature:dragon","target":"item:dragon-shield","introduced_in":"15.20","removed_in":null,"completeness":"complete","enabled":true,"source_path":"monster/dragons/dragon.lua","data":{"chance_numerator":100,"chance_denominator":100000,"minimum_count":1,"maximum_count":1,"container_path":null,"condition_data":null}},{"type":"creature_loot","canonical_key":"loot:dragon:future-blade","source":"creature:dragon","target":"item:future-blade","introduced_in":"15.30","removed_in":null,"completeness":"complete","enabled":true,"source_path":"monster/dragons/dragon.lua","data":{"chance_numerator":1,"chance_denominator":100000,"minimum_count":1,"maximum_count":1,"container_path":null,"condition_data":null}}]}
